{
  "schema_version": 1,
  "source": {
    "agent": "claude_code",
    "agent_session_id": "5f1c2a9e-1111-4c1e-9d7e-0a1b2c3d4e5f",
    "agent_version": "2.1.0",
    "project_key": "github.com/acme/shop",
    "bundle_key": "feat/refund-shipping",
    "git": {
      "branch": "feat/refund-shipping",
      "commits": ["a1b2c3d", "0123456789abcdef0123456789abcdef01234567"]
    },
    "started_at": "2026-10-20T08:00:00Z",
    "ended_at": "2026-10-20T09:12:00Z"
  },
  "goal": "Decide whether refunds include the shipping fee.",
  "decisions": [
    {
      "id": 1,
      "what": "Refunds do not include the shipping fee.",
      "why": "The carrier fee is non-refundable and already paid.",
      "alternatives": ["Refund shipping for damaged items only"],
      "labels": ["business_sensitive"]
    }
  ],
  "outcome": "Refund service excludes shipping; tests added.",
  "open_items": ["Confirm policy text with support team"],
  "modules": ["refunds", "checkout"],
  "redactions": {
    "secret": 1,
    "pii": 0,
    "by_rule": {
      "aws-access-token": 1
    }
  },
  "provenance": {
    "prompt_version": "digest@1",
    "model": "fake",
    "produced_at": "2026-10-20T09:13:00Z"
  }
}
